{
  "schema_version": "v1",
  "scenario_id": "drop_widgets_table",
  "fault": "drop_widgets_table",
  "repetitions": 1,
  "approved": {
    "operations": [
      "run_sql",
      "request_backup_restore"
    ],
    "max_attempts": 3,
    "max_ttr_seconds": 300
  },
  "source": "docs/runbooks/drop_widgets_table.md"
}
